movieId,title,releaseDate,runtime,budget,genres,overview,tagline,popularity,revenue,director,cast,keywords
87,Dunston Checks In (1996),1996-01-12,88,16000000,Children|Comedy,"Hotel manager Robert Grant is forced by his boss to postpone his family vacation when a hotel critic checks in. Trouble is, the critic is really a villainous jewel thief with an orangutan assistant named Dunston. When Dunston gets loose and tries to escape a life of crime -- aided by Robert's sons -- havoc, hijinks and lots of laughs abound!",He's about to turn a Five Star Hotel into a three ring circus.,4.806037,0,Ken Kwapis,Jason Alexander|Faye Dunaway|Eric Lloyd|Rupert Everett|Graham Sack,boss|fistfight|bully|orangutan|hotel manager
88,Black Sheep (1996),1996-02-01,87,0,Comedy,"When dignified Albert Donnelly runs for Governor, his team moves to keep his slow-witted and klutzy younger brother, Mike, out of the eye of the media. To baby-sit Mike, the campaign assigns sarcastic Steve, who gets the experience of a lifetime when he tries to take Mike out of town during the election.",There's one in every family.,4.826386,32,Penelope Spheeris,Chris Farley|David Spade|Grant Heslov|Tim Matheson|Gary Busey,nitrous oxide|candid camera|double act|political satire|crooked politician|woman director
89,Nick of Time (1995),1995-11-22,90,8169363,Action|Thriller,"Gene Watson is a public accountant who arrives on a train at Union Station in Los Angeles, accompanied by his 6-year-old daughter Lynn. Because of his ordinary looks, he is approached by a pair of sinister people named Smith and Jones.",,7.200592,8175346,John Badham,Johnny Depp|Courtney Chase|Charles S. Dutton|Christopher Walken|Roma Maffia,assassination|train station|politics|los angeles
92,Mary Reilly (1996),1996-02-23,104,47000000,Drama|Horror|Thriller,"A housemaid falls in love with Dr. Jekyll and his darkly mysterious counterpart, Mr. Hyde.",The untold story of Jekyll and Hyde,5.547472,12379402,Stephen Frears,Julia Roberts|John Malkovich|George Cole|Michael Gambon|Glenn Close,servant|monster|laboratory|jekyll and hyde|housemaid|19th century
93,Vampire in Brooklyn (1995),1995-10-26,100,14000000,Comedy|Horror|Romance,"Maximillian, the lone survivor of a race of vampires, comes to Brooklyn in search of a way to live past the next full moon. His ticket to survival is Rita, a NYPD detective who doesn't know she's half vampire -- and Maximillian will do whatever's necessary to put her under his spell.",A comic tale of horror and seduction.,6.405186,19800000,Wes Craven,Eddie Murphy|Angela Bassett|Allen Payne|Kadeem Hardison|John Witherspoon,vampire|half vampire
94,Beautiful Girls (1996),1996-02-09,112,0,Comedy|Drama|Romance,"During a snowy winter in the small fictional town of Knight""s Ridge, Massachusetts, a group of lifelong buddies hang out, drink and struggle to connect with the women who affect their decisions, dreams and desires.","Good times never seemed so good,",9.120073,0,Ted Demme,Matt Dillon|Noah Emmerich|Annabeth Gish|Lauren Holly|Timothy Hutton,coming of age|hometown
95,Broken Arrow (1996),1996-02-09,108,50000000,Action|Adventure|Thriller,"When rogue stealth-fighter pilot Vic Deakins deliberately drops off the radar while on maneuvers, the Air Force ends up with two stolen nuclear warheads -- and Deakins's co-pilot, Riley Hale, is the military's only hope for getting them back. Traversing the deserted canyons of Utah, Hale teams with park ranger Terry Carmichael to put Deakins back in his box.",Prepare to Go Ballistic.,8.430079,150270147,John Woo,John Travolta|Christian Slater|Samantha Mathis|Delroy Lindo|Bob Gunton,helicopter|river|captain|underground|mexican standoff|countdown|pilot|fistfight|canyon|major|betrayal|gunfight|train|explosion|park ranger|desert|military|nuclear device|boxing|stealth aircraft|abandoned mine|humvee
96,In the Bleak Midwinter (1995),1995-12-01,99,0,Comedy|Drama,"Out of work actor Joe volunteers to help try and save his sister's local church for the community by putting on a Christmas production of Hamlet, somewhat against the advice of his agent Margaretta. As the cast he assembles are still available even at Christmas and are prepared to do it on a 'profit sharing' basis (that is, they may not get paid anything) he cannot expect - and does not get - the cream of the cream. But although they all bring their own problems and foibles along, something bigger starts to emerge in the perhaps aptly named village of Hope.",The drama. The passion. The intrigue... And the rehearsals haven't even started.,0.816334,0,Kenneth Branagh,Richard Briers|Joan Collins|Michael Maloney|Nicholas Farrell|Jennifer Saunders,play|hamlet|christmas|actor
97,"Hate (Haine, La) (1995)",1995-05-31,98,3000000,Crime|Drama,"Aimlessly whiling away their days in the concrete environs of their dead-end suburbia, Vinz, Hubert, and Said -- a Jew, African, and an Arab -- give human faces to France's immigrant populations, their bristling resentment at their social marginalization slowly simmering until it reaches a climactic boiling point. La Haine means Hate.",Three Young Friends... One Last Chance.,9.039747,0,Mathieu Kassovitz,Vincent Cassel|Hubert Koundé|Saïd Taghmaoui|Abdel Ahmed Ghili|Souleymane Dicko,paris|neo-nazi|skinhead|robbery|police brutality|hip-hop|gun|socially deprived family|breakdance|arabian|boredom|revenge|suburb|violence|police officer|unemployment|capture|xenophobia
98,Shopping (1994),1994-12-06,105,0,Action|Thriller,"A dark, hip, urban story of a barren and anonymous city where the underclass' sport of choice is ram-raiding. An exciting game in which stolen cars are driven through shop windows to aid large-scale looting before the police arrive. For Tommy, it's a business, but for Billy and Jo, it's a labour of love. As the competition between Tommy and Billy grows more fierce, the stakes become higher and the ""shopping"" trips increasingly risky.",No one leaves without paying...,1.016221,0,Paul W.S. Anderson,Sadie Frost|Jude Law|Sean Pertwee|Fraser James|Sean Bean,
99,Heidi Fleiss: Hollywood Madam (1995),1995-12-27,106,0,Documentary,"A documentary crew from the BBC arrives in L.A. intent on interviewing Heidi Fleiss, a year after her arrest for running a brothel but before her trial. Several months elapse before the interview, so the crew searches for anyone who'll talk about the young woman. Two people have a lot to say to the camera: a retired madam named Alex for whom Fleiss once worked and Fleiss's one-time boyfriend, Ivan Nagy, who introduced her to Alex. Alex and Nagy don't like each other, so the crew shuttles between them with ""she said"" and ""he said."" When they finally interview Fleiss, they spend their time reciting what Alex and Nagy have had to say and asking her reaction.",   ,0.483176,0,Nick Broomfield,Nick Broomfield|Heidi Fleiss|Madam Alex|Ivan Nagy|Corinne Bohrer,narration|hollywood|prostitution
100,City Hall (1996),1996-02-16,111,0,Drama|Thriller,"The accidental shooting of a boy in New York leads to an investigation by the Deputy Mayor, and unexpectedly far-reaching consequences.",It started with a shootout on a rainswept street and ended in a scandal that shattered New York.,5.208898,0,Harold Becker,Al Pacino|John Cusack|Bridget Fonda|Danny Aiello|Martin Landau,corruption|undercover|war on drugs|mayor|drug dealer|presidential election|undercover agent|investigation|police|drugs
